idDrink,Name,Category,Alcoholic,Glass,Instructions,Thumbnail,Ingredient1,Ingredient2,Ingredient3,Ingredient4,Ingredient5,Ingredient6,Measure1,Measure2,Measure3,Measure4,Measure5,Measure6,Measure1 (ml),Measure2 (ml),Measure3 (ml),Measure4 (ml),Measure5 (ml),Measure6 (ml)
17222,A1,Cocktail,Alcoholic,Cocktail glass,"Pour all ingredients into a cocktail shaker, mix and serve over ice into a chilled glass.",https://www.thecocktaildb.com/images/media/drink/2x8thr1504816928.jpg,Gin,Grand Marnier,Lemon Juice,Grenadine,,,1 3/4 *44 ml ,1 *44 ml,1/4 *44 ml,1/8 *44 ml,0,0,143,44,11,5.5,0,0
13501,ABC,Shot,Alcoholic,Shot glass,Layered in a shot glass.,https://www.thecocktaildb.com/images/media/drink/tqpvqp1472668328.jpg,Amaretto,Baileys irish cream,Cognac,,,,1/3 ,1/3 ,1/3 ,0,0,0,0.333333333333333,0.333333333333333,0.333333333333333,0,0,0
17225,Ace,Cocktail,Alcoholic,Martini Glass,Shake all the ingredients in a cocktail shaker and ice then strain in a cold glass.,https://www.thecocktaildb.com/images/media/drink/l3cd7f1504818306.jpg,Gin,Grenadine,Heavy cream,Milk,Egg White,,2 *44 mls ,1/2 *44 ml ,1/2 *44 ml ,1/2 *44 ml,1/2 Fresh,0,88,22,22,22,1/2 Fresh,0
17837,Adam,Ordinary Drink,Alcoholic,Cocktail glass,"In a shaker half-filled with ice cubes, combine all of the ingredients. Shake well. Strain into a cocktail glass.",https://www.thecocktaildb.com/images/media/drink/v0at4i1582478473.jpg,Dark rum,Lemon juice,Grenadine,,,,2 *30 ml ,1 *30 ml ,1 *5 ml ,0,0,0,60,30,5,0,0,0
13938,AT&T,Ordinary Drink,Alcoholic,Highball Glass,"Pour Vodka and Gin over ice, add Tonic and Stir",https://www.thecocktaildb.com/images/media/drink/rhhwmp1493067619.jpg,Absolut Vodka,Gin,Tonic water,,,,1 *30 ml ,1 *30 ml ,4 *30 ml ,0,0,0,30,30,120,0,0,0
14610,ACID,Shot,Alcoholic,Shot glass,Poor in the 151 first followed by the 101 served with a Coke or Dr Pepper chaser.,https://www.thecocktaildb.com/images/media/drink/xuxpxt1479209317.jpg,151 proof rum,Wild Turkey,,,,,1 *30 ml Bacardi ,1 *30 ml ,0,0,0,0,30,30,0,0,0,0
17833,A. J.,Ordinary Drink,Alcoholic,Cocktail glass,"Shake ingredients with ice, strain into a cocktail glass, and serve.",https://www.thecocktaildb.com/images/media/drink/l74qo91582480316.jpg,Applejack,Grapefruit juice,,,,,1 1/2 *30 ml ,1 *30 ml ,0,0,0,0,165,30,0,0,0,0
17839,Affair,Ordinary Drink,Alcoholic,Highball glass,"Pour schnapps, orange juice, and cranberry juice over ice in a highball glass. Top with club soda and serve.",https://www.thecocktaildb.com/images/media/drink/h5za6y1582477994.jpg,Strawberry schnapps,Orange juice,Cranberry juice,Club soda,,,2 *30 ml ,2 *30 ml ,2 *30 ml ,0,0,0,60,60,60,0,0,0
15266,Avalon,Ordinary Drink,Alcoholic,Highball glass,"Fill a tall glass with ice. Layer the Finlandia Vodka, lemon and apple juices, Pisang Ambon, and top up with lemonade. Stir slightly and garnish with a spiralled cucumber skin and a red cherry. The cucumber provides zest and looks attractive. This drink, created by Timo Haimi, took first prize in the 1991 Finlandia Vodka Long Drink Competition.",https://www.thecocktaildb.com/images/media/drink/3k9qic1493068931.jpg,Vodka,Pisang Ambon,Apple juice,Lemon juice,Lemonade,,3,1,6,1 1/2,0,0,3,1,6,1 1/2,0,0
17835,Abilene,Ordinary Drink,Alcoholic,Highball glass,Pour all of the ingredients into a highball glass almost filled with ice cubes. Stir well.,https://www.thecocktaildb.com/images/media/drink/smb2oe1582479072.jpg,Dark rum,Peach nectar,Orange juice,,,,1 1/2 *30 ml ,2 *30 ml ,3 *30 ml ,0,0,0,165,60,90,0,0,0
11023,Almeria,Ordinary Drink,Alcoholic,Cocktail glass,"In a shaker half-filled with ice cubes, combine all of the ingredients. Shake well. Strain into a cocktail glass.",https://www.thecocktaildb.com/images/media/drink/rwsyyu1483388181.jpg,Dark rum,Kahlua,Egg white,,,,2 *30 ml ,1 *30 ml ,1,0,0,0,60,30,1,0,0,0
17228,Addison,Cocktail,Alcoholic,Martini Glass,Shake together all the ingredients and strain into a cold glass.,https://www.thecocktaildb.com/images/media/drink/yzva7x1504820300.jpg,Gin,Vermouth,,,,,1 1/2 *44 ml ,1 1/2 *44 ml ,0,0,0,0,242,242,0,0,0,0
17836,Acapulco,Ordinary Drink,Alcoholic,Old-fashioned glass,Combine and shake all ingredients (except mint) with ice and strain into an old-fashioned glass over ice cubes. Add the sprig of mint and serve.,https://www.thecocktaildb.com/images/media/drink/il9e0r1582478841.jpg,Light rum,Triple sec,Lime juice,Sugar,Egg white,Mint,1 1/2 *30 ml ,1 1/2 tsp ,1 *15 ml ,1 tsp ,1,1,165,1 1/2 tsp ,15,1 tsp ,1,1
17840,Affinity,Ordinary Drink,Alcoholic,Cocktail glass,"In a mixing glass half-filled with ice cubes, combine all of the ingredients. Stir well. Strain into a cocktail glass.",https://www.thecocktaildb.com/images/media/drink/wzdtnn1582477684.jpg,Scotch,Sweet Vermouth,Dry Vermouth,Orange bitters,,,1 1/2 *30 ml ,1 *30 ml ,1 *30 ml ,2 dashes ,0,0,165,30,30,2 dashes ,0,0
11046,Applecar,Ordinary Drink,Alcoholic,Cocktail glass,"Shake all ingredients with ice, strain into a cocktail glass, and serve.",https://www.thecocktaildb.com/images/media/drink/sbffau1504389764.jpg,Applejack,Triple sec,Lemon juice,,,,1 *30 ml ,1 *30 ml ,1 *30 ml ,0,0,0,30,30,30,0,0,0
17180,Aviation,Cocktail,Alcoholic,Cocktail glass,Add all ingredients into cocktail shaker filled with ice. Shake well and strain into cocktail glass. Garnish with a cherry.,https://www.thecocktaildb.com/images/media/drink/ruutxt1478253328.jpg,Gin,lemon juice,maraschino liqueur,,,,4.5 *10 ml,1.5 *10 ml,1.5 *10 ml,0,0,0,45,15,15,0,0,0
11014,Alexander,Ordinary Drink,Alcoholic,Cocktail glass,Shake all ingredients with ice and strain contents into a cocktail glass. Sprinkle nutmeg on top and serve.,https://www.thecocktaildb.com/images/media/drink/urystu1478253039.jpg,Gin,Creme de Cacao,Light cream,Nutmeg,,,1/2 *30 ml ,1/2 *30 ml white ,2 *30 ml ,0,0,0,15,15,60,0,0,0
11020,Algonquin,Ordinary Drink,Alcoholic,Cocktail glass,"Combine and shake all ingredients with ice, strain contents into a cocktail glass, and serve.",https://www.thecocktaildb.com/images/media/drink/uwryxx1483387873.jpg,Blended whiskey,Dry Vermouth,Pineapple juice,,,,1 1/2 *30 ml ,1 *30 ml ,1 *30 ml ,0,0,0,165,30,30,0,0,0
11021,Allegheny,Ordinary Drink,Alcoholic,Cocktail glass,Shake all ingredients (except lemon peel) with ice and strain into a cocktail glass. Top with the twist of lemon peel and serve.,https://www.thecocktaildb.com/images/media/drink/uwvyts1483387934.jpg,Dry Vermouth,Bourbon,Blackberry brandy,Lemon juice,Lemon peel,,1 *30 ml ,1 *30 ml ,1 1/2 tsp ,1 1/2 tsp ,1 twist of ,0,30,30,1 1/2 tsp ,1 1/2 tsp ,1 twist of ,0
11055,Artillery,Ordinary Drink,Alcoholic,Cocktail glass,"Stir all ingredients with ice, strain into a cocktail glass, and serve.",https://www.thecocktaildb.com/images/media/drink/g1vnbe1493067747.jpg,Sweet Vermouth,Gin,Bitters,,,,1 1/2 tsp ,1 1/2 *30 ml ,2 dashes ,0,0,0,1 1/2 tsp ,165,2 dashes ,0,0,0
12756,Autodafé,Ordinary Drink,Alcoholic,Highball glass,Mix and fill up with soda water. Drunk by finns on a sunny day any time of the year and day.,https://www.thecocktaildb.com/images/media/drink/7dkf0i1487602928.jpg,Vodka,Lime juice,Soda water,,,,4 *10 ml ,1 dash ,0,0,0,0,40,1 dash ,0,0,0,0
13162,Afternoon,Coffee / Tea,Alcoholic,Collins Glass,"Build into a suiting glass, with no ice. Cream on top if wanted. Served directly.",https://www.thecocktaildb.com/images/media/drink/vyrurp1472667777.jpg,Kahlua,Baileys irish cream,Frangelico,Coffee,Cream,,1 *10 ml ,1 *10 ml ,1 1/2 ,4 *10 ml hot ,0,0,10,10,1 1/2 ,40,0,0
15182,After sex,Ordinary Drink,Alcoholic,Highball glass,Pour the vodka and creme over some ice cubes in a tall glass and fill up with juice. to make it beuty full make the top of the glass with a grenadine and sugar,https://www.thecocktaildb.com/images/media/drink/xrl66i1493068702.jpg,Vodka,Creme de Banane,Orange juice,,,,2 *10 ml ,1 *10 ml ,0,0,0,0,20,10,0,0,0,0
13332,B-53,Shot,Alcoholic,Collins Glass,"Layer the Kahlua, Sambucca and Grand Marnier into a shot glas in that order. Better than B-52",https://www.thecocktaildb.com/images/media/drink/rwqxrv1461866023.jpg,Kahlua,Sambuca,Grand Marnier,,,,1/3 *44 ml ,1/3 *44 ml ,1/3 *44 ml ,0,0,0,14.6666666666667,14.6666666666667,14.6666666666667,0,0,0
15853,B-52,Shot,Alcoholic,Shot glass,Layer ingredients into a shot glass. Serve with a stirrer.,https://www.thecocktaildb.com/images/media/drink/5a3vg61504372070.jpg,Baileys irish cream,Grand Marnier,Kahlua,,,,1/3 ,1/3 ,1/4 ,0,0,0,0.333333333333333,0.333333333333333,0.25,0,0,0
17254,Bijou,Cocktail,Alcoholic,Cocktail glass,"Stir in mixing glass with ice and strain
",https://www.thecocktaildb.com/images/media/drink/rysb3r1513706985.jpg,Orange Bitters,Green Chartreuse,Gin,Sweet Vermouth,,,1 dash,1 *30 ml,1 *30 ml,1 *30 ml,0,0,1 dash,30,30,30,0,0
11149,Boxcar,Ordinary Drink,Alcoholic,Whiskey sour glass,"In a shaker half-filled with ice cubes, combine all of the ingredients. Shake well. Strain into a sour glass.",https://www.thecocktaildb.com/images/media/drink/pwgtpa1504366376.jpg,Gin,Triple sec,Lemon juice,Grenadine,Egg white,,1 1/2 *30 ml ,1 *30 ml ,1 tsp ,1/2 tsp ,1,0,165,30,1 tsp ,1/2 tsp ,1,0
13222,Big Red,Shot,Alcoholic,Shot glass,Pour ingredients into 1 ounce shot glass,https://www.thecocktaildb.com/images/media/drink/yqwuwu1441248116.jpg,Irish cream,Goldschlager,,,,,1/2 *30 ml ,1/2 *30 ml ,0,0,0,0,15,15,0,0,0,0
17195,Bellini,Ordinary Drink,Alcoholic,Champagne Flute,"Pour peach purée into chilled flute, add sparkling wine. Stir gently.",https://www.thecocktaildb.com/images/media/drink/eaag491504367543.jpg,Champagne,Peach schnapps,,,,,6 *30 ml ,1 *30 ml ,0,0,0,0,180,30,0,0,0,0
17210,Bramble,Ordinary Drink,Alcoholic,Old-Fashioned glass,"Fill glass with crushed ice. Build gin, lemon juice and simple syrup over. Stir, and then pour blackberry liqueur over in a circular fashion to create marbling effect. Garnish with two blackberries and lemon slice.",https://www.thecocktaildb.com/images/media/drink/lvzl3r1504372526.jpg,Gin,lemon juice,Sugar syrup,Creme de Mure,,,4 *10 ml,1.5 *10 ml,1 *10 ml,1.5 *10 ml,0,0,40,15,10,15,0,0
11060,Balmoral,Ordinary Drink,Alcoholic,Cocktail glass,"In a mixing glass half-filled with ice cubes, combine all of the ingredients. Stir well. Strain into a cocktail glass.",https://www.thecocktaildb.com/images/media/drink/vysuyq1441206297.jpg,Scotch,Sweet Vermouth,Dry Vermouth,Bitters,,,1 1/2 *30 ml ,1/2 *30 ml ,1/2 *30 ml ,2 dashes ,0,0,165,15,15,2 dashes ,0,0
11120,Bluebird,Ordinary Drink,Alcoholic,Cocktail glass,"In a mixing glass half-filled with crushed ice, combine the gin, triple sec, Curacao, and bitters. Stir well. Strain into a cocktail glass and garnish with the lemon twist and the cherry.",https://www.thecocktaildb.com/images/media/drink/5jhyd01582579843.jpg,Gin,Triple sec,Blue Curacao,Bitters,Maraschino cherry,Lemon peel,1 1/2 *30 ml ,1/2 *30 ml ,1/2 *30 ml ,2 dashes ,1,1 twist of ,165,15,15,2 dashes ,1,1 twist of 
178310,Brooklyn,Cocktail,Alcoholic,Cocktail glass,Combine ingredients with ice and stir until well-chilled. Strain into a chilled cocktail glass.,https://www.thecocktaildb.com/images/media/drink/ojsezf1582477277.jpg,Rye Whiskey,Dry Vermouth,Maraschino Liqueur,Angostura Bitters,Maraschino Cherry,,2 *30 ml,1 *30 ml,1/4 *30 ml,3 dashes,1,0,60,30,7.5,3 dashes,1,0
11124,Boomerang,Ordinary Drink,Alcoholic,Cocktail glass,"In a mixing glass half-filled with ice cubes, combine the gin, vermouth, bitters, and maraschino liqueur. Stir well. Strain into a cocktail glass and garnish with the cherry.",https://www.thecocktaildb.com/images/media/drink/3m6yz81504389551.jpg,Gin,Dry Vermouth,Bitters,Maraschino liqueur,Maraschino cherry,,2 *30 ml ,1/2 *30 ml ,2 dashes ,1/2 tsp ,1,0,60,15,2 dashes ,1/2 tsp ,1,0
17209,Barracuda,Ordinary Drink,Alcoholic,Margarita glass,"Shake pour ingredients with ice. Strain into glass, top with Sparkling wine.",https://www.thecocktaildb.com/images/media/drink/jwmr1x1504372337.jpg,Rum,Galliano,Pineapple Juice,Lime Juice,Prosecco,,4.5 *10 ml,1.5 *10 ml,6 *10 ml, 1 dash,top up ,0,45,15,60, 1 dash,top up ,0
17035,Buccaneer,Beer,Alcoholic,Beer pilsner,Pour the corona into an 18oz beer glass pour the bacardi limon into the beer stir very gently,https://www.thecocktaildb.com/images/media/drink/upvtyt1441249023.jpg,Corona,Bacardi Limon,,,,,1,1 *44 ml ,0,0,0,0,1,44,0,0,0,0
17825,Brigadier,Cocktail,Alcoholic,Coupe Glass,Mix ingredients in a warmed mug and stir.,https://www.thecocktaildb.com/images/media/drink/nl89tf1518947401.jpg,Hot Chocolate,Green Chartreuse,Cherry Heering,,,,4 *30 ml,1 *30 ml,1 *30 ml,0,0,0,120,30,30,0,0,0
178311,Broadside,Cocktail,Alcoholic,Highball glass,"Half fill the glass with ice cubes. Crush the wormwood and add to ice. Pour rum, scotch and butters, then serve!",https://www.thecocktaildb.com/images/media/drink/l2o6xu1582476870.jpg,151 proof rum,Scotch,Bitters,Wormwood,Ice,,1 *44 ml,1/2 *44 ml,3 drops,1 Fresh,cubes,0,44,22,3 drops,1 Fresh,cubes,0
11106,Blackthorn,Ordinary Drink,Alcoholic,Cocktail glass,Stir sloe gin and vermouth with ice and strain into a cocktail glass. Add the twist of lemon peel and serve.,https://www.thecocktaildb.com/images/media/drink/xvswvy1441209430.jpg,Sweet Vermouth,Sloe gin,Lemon peel,,,,1 *30 ml ,1 1/2 *30 ml ,1 twist of ,0,0,0,30,165,1 twist of ,0,0,0
13395,Bob Marley,Shot,Alcoholic,Shot glass,Layer in a 2 oz shot glass or pony glass,https://www.thecocktaildb.com/images/media/drink/rrqrst1477140664.jpg,Midori melon liqueur,Jägermeister,Goldschlager,,,,1/2 *30 ml ,1/2 *30 ml ,1/2 *30 ml ,0,0,0,15,15,15,0,0,0
14730,Bubble Gum,Shot,Alcoholic,Shot glass,Layer in order into a shot glass.,https://www.thecocktaildb.com/images/media/drink/spuurv1468878783.jpg,Vodka,Banana liqueur,Orange juice,Peach schnapps,,,1/4 ,1/4 ,1/4 ,1/4 ,0,0,0.25,0.25,0.25,0.25,0,0
16986,Bible Belt,Other/Unknown,Alcoholic,Highball glass,"Mix all ingredients, and pour over ice.",https://www.thecocktaildb.com/images/media/drink/6bec6v1503563675.jpg,Southern Comfort,Triple sec,Lime,Sour mix,,,2 *30 ml ,1/2 *30 ml ,2 wedges ,2 *30 ml ,0,0,60,15,2 wedges ,60,0,0
17120,Brain Fart,Punch / Party Drink,Alcoholic,Punch bowl,Mix all ingredients together. Slowly and gently. Works best if ice is added to punch bowl and soda's are very cold.,https://www.thecocktaildb.com/images/media/drink/rz5aun1504389701.jpg,Everclear,Vodka,Mountain Dew,Surge,Lemon juice,Rum,1 fifth ,1 fifth Smirnoff red label ,2 L ,2 L ,1 small bottle ,1 pint ,1 fifth ,1 fifth Smirnoff red label ,2 L ,2 L ,1 small bottle ,1 pint 
11113,Bloody Mary,Ordinary Drink,Alcoholic,Old-fashioned glass,"Stirring gently, pour all ingredients into highball glass. Garnish.",https://www.thecocktaildb.com/images/media/drink/t6caa21582485702.jpg,Vodka,Tomato juice,Lemon juice,Worcestershire sauce,Tabasco sauce,Lime,1 1/2 *30 ml ,3 *30 ml ,1 dash ,1/2 tsp ,2-3 drops ,1 wedge ,165,90,1 dash ,1/2 tsp ,2-3 drops ,1 wedge 
11117,Blue Lagoon,Ordinary Drink,Alcoholic,Highball glass,"Pour vodka and curacao over ice in a highball glass. Fill with lemonade, top with the cherry, and serve.",https://www.thecocktaildb.com/images/media/drink/5wm4zo1582579154.jpg,Vodka,Blue Curacao,Lemonade,Cherry,,,1 *30 ml ,1 *30 ml ,0,0,0,0,30,30,0,0,0,0
11129,Boston Sour,Ordinary Drink,Alcoholic,Whiskey sour glass,"Shake juice of lemon, powdered sugar, blended whiskey, and egg white with cracked ice and strain into a whiskey sour glass. Add the slice of lemon, top with the cherry, and serve.",https://www.thecocktaildb.com/images/media/drink/kxlgbi1504366100.jpg,Blended whiskey,Lemon,Powdered sugar,Egg white,Lemon,Cherry,2 *30 ml ,Juice of 1/2 ,1 tsp ,1,1 slice ,1,60,Juice of 1/2 ,1 tsp ,1,1 slice ,1
11164,Brandy Flip,Ordinary Drink,Alcoholic,Whiskey sour glass,"In a shaker half-filled with ice cubes, combine the brandy, egg, sugar, and cream. Shake well. Strain into a sour glass and garnish with the nutmeg.",https://www.thecocktaildb.com/images/media/drink/6ty09d1504366461.jpg,Brandy,Egg,Sugar,Light cream,Nutmeg,,2 *30 ml ,1 whole ,1 tsp superfine ,1/2 *30 ml ,1/8 tsp grated ,0,60,1 whole ,1 tsp superfine ,15,1/8 tsp grated ,0
17185,Casino,Ordinary Drink,Alcoholic,Cocktail glass,Pour all ingredients into shaker with ice cubes. Shake well. Strain into chilled cocktail glass. Garnish with a lemon twist and a maraschino cherry. Serve without a straw.,https://www.thecocktaildb.com/images/media/drink/1mvjxg1504348579.jpg,Gin,Maraschino liqueur,Lemon juice,Orange bitters,Cherry,,2 *30 ml ,1/4 tsp ,1/4 tsp ,2 dashes ,1,0,60,1/4 tsp ,1/4 tsp ,2 dashes ,1,0
11202,Caipirinha,Ordinary Drink,Alcoholic,Old-fashioned glass,Place lime and sugar into old fashioned glass and muddle (mash the two ingredients together using a muddler or a wooden spoon). Fill the glass with ice and add the Cachaça.,https://www.thecocktaildb.com/images/media/drink/jgvn7p1582484435.jpg,Sugar,Lime,Cachaca,,,,2 tsp,1,2 1/2 *30 ml ,0,0,0,2 tsp,1,315,0,0,0
11239,Cherry Rum,Ordinary Drink,Alcoholic,Cocktail glass,"Shake all ingredients with ice, strain into a cocktail glass, and serve.",https://www.thecocktaildb.com/images/media/drink/twsuvr1441554424.jpg,Light rum,Cherry brandy,Light cream,,,,1 1/4 *30 ml ,1 1/2 tsp ,1 *15 ml ,0,0,0,82.5,1 1/2 tsp ,15,0,0,0
11288,Cuba Libre,Ordinary Drink,Alcoholic,Highball glass,Build all ingredients in a Collins glass filled with ice. Garnish with lime wedge.,https://www.thecocktaildb.com/images/media/drink/uuxsrr1473201663.jpg,Light rum,Lime,Coca-Cola,,,,2 *30 ml ,Juice of 1/2 ,0,0,0,0,60,Juice of 1/2 ,0,0,0,0
13751,Cuba Libra,Ordinary Drink,Alcoholic,Highball glass,Fill tall glass with ice cubes. Add rum. Rub cut edge of lime on rim of glass then squeeze juice into glass. Fill with Coca-Cola. Garnish with lime slice. Enjoy!,https://www.thecocktaildb.com/images/media/drink/ck6d0p1504388696.jpg,Dark rum,Lime,Coca-Cola,Ice,,,1-2 *44 ml ,Squeeze ,Fill with ,0,0,0,Squeeze ,Fill with ,0,0,0,0
14181,Cafe Savoy,Coffee / Tea,Alcoholic,Coffee mug,"Fill mug almost to top with coffee.Add milk, triple sec and brandy. Stir.",https://www.thecocktaildb.com/images/media/drink/vqwptt1441247711.jpg,Coffee,Milk,Triple sec,Brandy,,,0,1/2 *30 ml ,1/2 *30 ml ,0,0,0,0,15,15,0,0,0
14608,Cream Soda,Cocktail,Alcoholic,Highball glass,Pour 1oz of Spiced Rum into a highball glass with ice. Fill with Ginger Ale.,https://www.thecocktaildb.com/images/media/drink/yqstxr1479209367.jpg,Spiced rum,Ginger ale,,,,,1 *30 ml ,0,0,0,0,0,30,0,0,0,0,0
17830,Corn n Oil,Cocktail,Alcoholic,Old-fashioned glass,"Cut the half lime in half again. Add the lime, falernum, and bitters to a rocks glass. Muddle. Add the rum. (Aged Barbados rum such as Plantation 5 Year is recommended). Add ice and stir. Float the blackstrap rum on top. Serve with a straw.",https://www.thecocktaildb.com/images/media/drink/pk6dwi1592767243.jpg,Lime,Falernum,Angostura Bitters,Añejo rum,blackstrap rum,,1/2,1/3 *30 ml,2 dashes,1 *30 ml,1 *30 ml,0,0.5,10,2 dashes,30,30,0
11222,Casa Blanca,Ordinary Drink,Alcoholic,Cocktail glass,"Shake all ingredients with ice, strain into a cocktail glass, and serve.",https://www.thecocktaildb.com/images/media/drink/usspxq1441553762.jpg,Light rum,Triple sec,Lime juice,Maraschino liqueur,,,2 *30 ml ,1 1/2 tsp ,1 1/2 tsp ,1 1/2 tsp ,0,0,60,1 1/2 tsp ,1 1/2 tsp ,1 1/2 tsp ,0,0
17186,Clover Club,Ordinary Drink,Alcoholic,Cocktail glass,"Dry shake ingredients to emulsify, add ice, shake and served straight up.",https://www.thecocktaildb.com/images/media/drink/t0aja61504348715.jpg,Gin,Grenadine,Lemon,Egg white,,,1 1/2 *30 ml ,2 tsp ,Juice of 1/2 ,1,0,0,165,2 tsp ,Juice of 1/2 ,1,0,0
17135,Citrus Coke,Soft Drink / Soda,Alcoholic,Highball Glass,Pour half of coke in a glass. Then add Bacardi and top it off with the remaining coke. Stir and drink up!,https://www.thecocktaildb.com/images/media/drink/uyrvut1479473214.jpg,Bacardi Limon,Coca-Cola,,,,,1,2,0,0,0,0,1,2,0,0,0,0
11242,Chicago Fizz,Ordinary Drink,Alcoholic,Highball glass,"Shake all ingredients (except carbonated water) with ice and strain into a highball glass over two ice cubes. Fill with carbonated water, stir, and serve.",https://www.thecocktaildb.com/images/media/drink/qwvwqr1441207763.jpg,Light rum,Port,Lemon,Powdered sugar,Egg white,Carbonated water,1 *30 ml ,1 *30 ml ,Juice of 1/2 ,1 tsp ,1,0,30,30,Juice of 1/2 ,1 tsp ,1,0
11251,City Slicker,Ordinary Drink,Alcoholic,Cocktail glass,"In a shaker half-filled with ice cubes, combine all of the ingredients. Shake well. Strain into a cocktail glass.",https://www.thecocktaildb.com/images/media/drink/dazdlg1504366949.jpg,Brandy,Triple sec,Lemon juice,,,,2 *30 ml ,1/2 *30 ml ,1 *15 ml ,0,0,0,60,15,15,0,0,0
12800,Coffee-Vodka,Homemade Liqueur,Alcoholic,Collins Glass,"Boil water and sugar until dissolved. Turn off heat. Slowly add dry instant coffee and continue stirring. Add a chopped vanilla bean to the vodka, then combine the cooled sugar syrup and coffee solution with the vodka. Cover tightly and shake vigorously each day for 3 weeks. Strain and filter. Its also best to let the sugar mixture cool completely so the vodka won't evaporate when its added. If you like a smoother feel to the liqueur you can add about 1 teaspoon of glycerine to the finished product.",https://www.thecocktaildb.com/images/media/drink/qvrrvu1472667494.jpg,Water,Sugar,Coffee,Vanilla,Vodka,Caramel coloring,2 cups ,2 cups white ,1/2 cup instant ,1/2,1 1/2 cup,0,2 cups ,2 cups white ,1/2 cup instant ,0.5,1 1/2 cup,0
13206,Caipirissima,Ordinary Drink,Alcoholic,Collins Glass,Same as Caipirinha but instead of cachaca you add WHITE RUM. It's great!!!!!!!!,https://www.thecocktaildb.com/images/media/drink/yd47111503565515.jpg,Lime,Sugar,White rum,Ice,,,2,2 *15 ml ,2-3 *30 ml ,crushed ,0,0,2,30,crushed ,0,0,0
16047,Campari Beer,Beer,Alcoholic,Beer mug,Use a 15 oz glass. Add Campari first. Fill with beer.,https://www.thecocktaildb.com/images/media/drink/xsqrup1441249130.jpg,Lager,Campari,,,,,1 bottle ,1 1/2 *10 ml ,0,0,0,0,1 bottle ,55,0,0,0,0
17196,Cosmopolitan,Cocktail,Alcoholic,Cocktail glass,Add all ingredients into cocktail shaker filled with ice. Shake well and double strain into large cocktail glass. Garnish with lime wheel.,https://www.thecocktaildb.com/images/media/drink/kpsajh1504368362.jpg,Absolut Citron,Lime juice,Cointreau,Cranberry juice,,,1 1/4 *30 ml ,1/4 *30 ml ,1/4 *30 ml ,1/4 cup ,0,0,82.5,7.5,7.5,1/4 cup ,0,0
11224,Casino Royale,Ordinary Drink,Alcoholic,Whiskey sour glass,"In a shaker half-filled with ice cubes, combine all of the ingredients. Shake well. Strain into a sour glass.",https://www.thecocktaildb.com/images/media/drink/3qpv121504366699.jpg,Gin,Lemon juice,Maraschino liqueur,Orange bitters,Egg yolk,,2 *30 ml ,1/2 *30 ml ,1 tsp ,1 dash ,1,0,60,15,1 tsp ,1 dash ,1,0
11255,Clove Cocktail,Ordinary Drink,Alcoholic,Cocktail glass,"Stir all ingredients with ice, strain into a cocktail glass, and serve.",https://www.thecocktaildb.com/images/media/drink/qxvtst1461867579.jpg,Sweet Vermouth,Sloe gin,Wine,,,,1 *30 ml ,1/2 *30 ml ,1/2 *30 ml Muscatel ,0,0,0,30,15,15,0,0,0
12798,Coffee Liqueur,Homemade Liqueur,Alcoholic,Collins Glass,"Combine coffee, sugar and water. Simmer 1 hour and let cool. Add vanilla and vodka. Age in sealed jar 2 to 3 weeks.",https://www.thecocktaildb.com/images/media/drink/ryvtsu1441253851.jpg,Coffee,Vanilla extract,Sugar,Vodka,Water,,10 *15 ml instant ,4 tblsp ,2 1/2 cups ,1 qt ,2 1/2 cups ,0,150,4 tblsp ,2 1/2 cups ,1 qt ,2 1/2 cups ,0
13328,Chocolate Milk,Shot,Alcoholic,Shot Glass,"Put the milk in the bottom, pour the Liquer on top and add the dash of amaretto. Do not mix. SLAM IT!",https://www.thecocktaildb.com/images/media/drink/j6q35t1504889399.jpg,Chocolate liqueur,Milk,Amaretto,,,,1/2 *44 ml ,1/2 *44 ml ,1 dash ,0,0,0,22,22,1 dash ,0,0,0
12808,Creme de Menthe,Homemade Liqueur,Alcoholic,Collins Glass,Bring sugar and water to a boil and simmer for 10 minutes. Cool. Add the remaining ingredients and stir. Cover and let ripen for 1 month.,https://www.thecocktaildb.com/images/media/drink/yxswtp1441253918.jpg,Sugar,Water,Grain alcohol,Peppermint extract,Food coloring,,8 cups ,6 cups ,1 pint ,1 *30 ml pure ,1 tblsp green ,0,8 cups ,6 cups ,1 pint ,30,1 tblsp green ,0
17187,Derby,Ordinary Drink,Alcoholic,Cocktail glass,Pour all ingredients into a mixing glass with ice. Stir. Strain into a cocktail glass. Garnish with a sprig of fresh mint in the drink.,https://www.thecocktaildb.com/images/media/drink/i502ra1504349156.jpg,gin,Peach Bitters,Mint,,,,6 *10 ml,2 dashes,2 Fresh leaves,0,0,0,60,2 dashes,2 Fresh leaves,0,0,0
13128,Diesel,Beer,Alcoholic,Pint glass,Pour the lager first then add the blackcurrant cordial. Top up with the cider. The colour sholud be very dark approaching the colour of Guiness.,https://www.thecocktaildb.com/images/media/drink/sxrrqq1454512852.jpg,Lager,Cider,Blackcurrant cordial,,,,1/2 pint ,1/2 pint ,1 dash ,0,0,0,1/2 pint ,1/2 pint ,1 dash ,0,0,0
11006,Daiquiri,Ordinary Drink,Alcoholic,Cocktail glass,Pour all ingredients into shaker with ice cubes. Shake well. Strain in chilled cocktail glass.,https://www.thecocktaildb.com/images/media/drink/mrz9091589574515.jpg,Light rum,Lime,Powdered sugar,,,,1 1/2 *30 ml ,Juice of 1/2 ,1 tsp ,0,0,0,165,Juice of 1/2 ,1 tsp ,0,0,0
15409,Danbooka,Coffee / Tea,Alcoholic,Coffee Mug,pour it in and mix it.,https://www.thecocktaildb.com/images/media/drink/vurrxr1441246074.jpg,Coffee,Everclear,,,,,3,1,0,0,0,0,3,1,0,0,0,0
11320,Dragonfly,Ordinary Drink,Alcoholic,Highball glass,"In a highball glass almost filled with ice cubes, combine the gin and ginger ale. Stir well. Garnish with the lime wedge.",https://www.thecocktaildb.com/images/media/drink/uc63bh1582483589.jpg,Gin,Ginger ale,Lime,,,,1 1/2 *30 ml ,4 *30 ml ,1,0,0,0,165,120,1,0,0,0
16991,Downshift,Punch / Party Drink,Alcoholic,Hurricane glass,"Start with the Sprite. Next comes the tequila. After that, add the Minute Maid Fruit Punch, then float the 151. Rocks optional.",https://www.thecocktaildb.com/images/media/drink/y36z8c1503563911.jpg,Fruit punch,Sprite,Tequila,151 proof rum,,,2,1,2 *44 mls ,Float Bacardi ,0,0,2,1,88,Float Bacardi ,0,0
